InvoiceNo,StockCode,Description,Quantity,date,price,Country
560590,22897,OVEN MITT APPLES DESIGN,10,7/19/11 15:55,"1,45",Germany
560590,22302,COFFEE MUG PEARS  DESIGN,6,7/19/11 15:55,"2,55",Germany
560590,23199,JUMBO BAG APPLES,10,7/19/11 15:55,"2,08",Germany
560590,22303,COFFEE MUG APPLES DESIGN,6,7/19/11 15:55,"2,55",Germany
560590,22704,WRAP RED APPLES,25,7/19/11 15:55,"0,42",Germany
560590,22895,SET OF 2 TEA TOWELS APPLE AND PEARS,12,7/19/11 15:55,"3,25",Germany
560590,22908,PACK OF 20 NAPKINS RED APPLES,12,7/19/11 15:55,"0,85",Germany
560590,23206,LUNCH BAG APPLE DESIGN,10,7/19/11 15:55,"1,65",Germany
560590,22630,DOLLY GIRL LUNCH BOX,12,7/19/11 15:55,"1,95",Germany
560590,22847,BREAD BIN DINER STYLE IVORY,1,7/19/11 15:55,"16,95",Germany
560590,85053,FRENCH ENAMEL CANDLEHOLDER,6,7/19/11 15:55,"2,1",Germany
560590,22430,ENAMEL WATERING CAN CREAM,4,7/19/11 15:55,"4,95",Germany
560590,16161P,WRAP ENGLISH ROSE,25,7/19/11 15:55,"0,42",Germany
560590,84030E,ENGLISH ROSE HOT WATER BOTTLE,20,7/19/11 15:55,"4,25",Germany
560590,84510A,SET OF 4 ENGLISH ROSE COASTERS,10,7/19/11 15:55,"1,25",Germany
560590,21884,CAKES AND BOWS GIFT  TAPE,12,7/19/11 15:55,"0,65",Germany
560590,22831,WHITE BROCANTE SOAP DISH,6,7/19/11 15:55,"2,95",Germany
560590,23196,VINTAGE LEAF MAGNETIC NOTEPAD,12,7/19/11 15:55,"1,45",Germany
560590,23198,PANTRY MAGNETIC  SHOPPING LIST,12,7/19/11 15:55,"1,45",Germany
560590,23243,SET OF TEA COFFEE SUGAR TINS PANTRY,4,7/19/11 15:55,"4,95",Germany
560590,23245,SET OF 3 REGENCY CAKE TINS,4,7/19/11 15:55,"4,95",Germany
560590,23291,DOLLY GIRL CHILDRENS CUP,8,7/19/11 15:55,"1,25",Germany
560590,23289,DOLLY GIRL CHILDRENS BOWL,8,7/19/11 15:55,"1,25",Germany
560590,23292,SPACEBOY CHILDRENS CUP,16,7/19/11 15:55,"1,25",Germany
560590,23290,SPACEBOY CHILDRENS BOWL,16,7/19/11 15:55,"1,25",Germany
560590,23293,SET OF 12 FAIRY CAKE BAKING CASES,8,7/19/11 15:55,"0,83",Germany
560590,23287,RED VINTAGE SPOT BEAKER,8,7/19/11 15:55,"0,85",Germany
560590,23288,GREEN VINTAGE SPOT BEAKER,8,7/19/11 15:55,"0,85",Germany
560590,23286,BLUE VINTAGE SPOT BEAKER,8,7/19/11 15:55,"0,85",Germany
560590,23308,SET OF 60 VINTAGE LEAF CAKE CASES,24,7/19/11 15:55,"0,55",Germany
560590,23307,SET OF 60 PANTRY DESIGN CAKE CASES,24,7/19/11 15:55,"0,55",Germany
560590,22961,JAM MAKING SET PRINTED,12,7/19/11 15:55,"1,45",Germany
560590,22960,JAM MAKING SET WITH JARS,6,7/19/11 15:55,"4,25",Germany
560590,22989,SET 2 PANTRY DESIGN TEA TOWELS,12,7/19/11 15:55,"3,25",Germany
560590,22907,PACK OF 20 NAPKINS PANTRY DESIGN,12,7/19/11 15:55,"0,85",Germany
560590,22692,DOORMAT WELCOME TO OUR HOME,4,7/19/11 15:55,"7,95",Germany
560590,22979,PANTRY WASHING UP BRUSH,12,7/19/11 15:55,"1,45",Germany
560590,22982,PANTRY PASTRY BRUSH,12,7/19/11 15:55,"1,25",Germany
560590,22980,PANTRY SCRUBBING BRUSH,12,7/19/11 15:55,"1,65",Germany
560590,23004,TRAVEL CARD WALLET PANTRY,24,7/19/11 15:55,"0,42",Germany
560590,20652,BLUE POLKADOT LUGGAGE TAG,12,7/19/11 15:55,"1,25",Germany
560590,22740,POLKADOT PEN,48,7/19/11 15:55,"0,85",Germany
560590,23285,PINK VINTAGE SPOT BEAKER,8,7/19/11 15:55,"0,85",Germany
560590,22697,GREEN REGENCY TEACUP AND SAUCER,6,7/19/11 15:55,"2,95",Germany
560590,23175,REGENCY MILK JUG PINK,4,7/19/11 15:55,"3,25",Germany
560590,23174,REGENCY SUGAR BOWL GREEN,4,7/19/11 15:55,"4,15",Germany
560590,22319,HAIRCLIPS FORTIES FABRIC ASSORTED,12,7/19/11 15:55,"0,65",Germany
560590,22624,IVORY KITCHEN SCALES,2,7/19/11 15:55,"8,5",Germany
560590,22627,MINT KITCHEN SCALES,2,7/19/11 15:55,"8,5",Germany
560590,22725,ALARM CLOCK BAKELIKE CHOCOLATE,4,7/19/11 15:55,"3,75",Germany
560590,22728,ALARM CLOCK BAKELIKE PINK,4,7/19/11 15:55,"3,75",Germany
560590,22726,ALARM CLOCK BAKELIKE GREEN,4,7/19/11 15:55,"3,75",Germany
560590,22729,ALARM CLOCK BAKELIKE ORANGE,4,7/19/11 15:55,"3,75",Germany
560590,22727,ALARM CLOCK BAKELIKE RED,4,7/19/11 15:55,"3,75",Germany
560590,22781,GUMBALL MAGAZINE RACK,2,7/19/11 15:55,"7,65",Germany
560590,23191,BUNDLE OF 3 RETRO NOTE BOOKS,12,7/19/11 15:55,"1,65",Germany
560590,23239,SET OF 4 KNICK KNACK TINS POPPIES,6,7/19/11 15:55,"4,15",Germany
560590,79191C,RETRO PLASTIC ELEPHANT TRAY,12,7/19/11 15:55,"0,85",Germany
560590,22629,SPACEBOY LUNCH BOX,12,7/19/11 15:55,"1,95",Germany
560590,22029,SPACEBOY BIRTHDAY CARD,12,7/19/11 15:55,"0,42",Germany
560590,22551,PLASTERS IN TIN SPACEBOY,12,7/19/11 15:55,"1,65",Germany
560590,22403,MAGNETS PACK OF 4 VINTAGE LABELS,12,7/19/11 15:55,"0,39",Germany
560590,23235,STORAGE TIN VINTAGE LEAF,6,7/19/11 15:55,"2,89",Germany
560590,23237,SET OF 4 KNICK KNACK TINS LEAF,6,7/19/11 15:55,"4,15",Germany
560590,23089,GLASS BON BON JAR,12,7/19/11 15:55,"1,65",Germany
560590,23202,JUMBO BAG VINTAGE LEAF,10,7/19/11 15:55,"2,08",Germany
560590,23244,ROUND STORAGE TIN VINTAGE LEAF,6,7/19/11 15:55,"1,95",Germany
560590,23208,LUNCH BAG VINTAGE LEAF DESIGN,10,7/19/11 15:55,"1,65",Germany
560590,22999,TRAVEL CARD WALLET VINTAGE LEAF,24,7/19/11 15:55,"0,42",Germany
560590,23232,WRAP VINTAGE LEAF DESIGN,25,7/19/11 15:55,"0,42",Germany
560590,20981,12 PENCILS TALL TUBE WOODLAND,12,7/19/11 15:55,"0,85",Germany
560590,22326,ROUND SNACK BOXES SET OF4 WOODLAND,6,7/19/11 15:55,"2,95",Germany
560590,22554,PLASTERS IN TIN WOODLAND ANIMALS,12,7/19/11 15:55,"1,65",Germany
560590,22637,PIGGY BANK RETROSPOT,8,7/19/11 15:55,"2,55",Germany
560590,22962,JAM JAR WITH PINK LID,12,7/19/11 15:55,"0,85",Germany
560590,22963,JAM JAR WITH GREEN LID,12,7/19/11 15:55,"0,85",Germany
563853,POST,POSTAGE,8,8/19/11 15:22,18,Germany
C564913,22998,TRAVEL CARD WALLET KEEP CALM,-24,8/31/11 12:39,"0,42",Germany
C564913,84030E,ENGLISH ROSE HOT WATER BOTTLE,-2,8/31/11 12:39,"4,25",Germany
C564913,23174,REGENCY SUGAR BOWL GREEN,-1,8/31/11 12:39,"4,15",Germany
C564913,22963,JAM JAR WITH GREEN LID,-2,8/31/11 12:39,"0,72",Germany
C564913,22637,PIGGY BANK RETROSPOT,-2,8/31/11 12:39,"2,1",Germany
C564913,22960,JAM MAKING SET WITH JARS,-1,8/31/11 12:39,"4,25",Germany
580511,21485,RETROSPOT HEART HOT WATER BOTTLE,6,12/4/11 13:54,"4,95",Germany
580511,22726,ALARM CLOCK BAKELIKE GREEN,8,12/4/11 13:54,"3,75",Germany
580511,22727,ALARM CLOCK BAKELIKE RED,8,12/4/11 13:54,"3,75",Germany
580511,22722,SET OF 6 SPICE TINS PANTRY DESIGN,4,12/4/11 13:54,"3,95",Germany
580511,22728,ALARM CLOCK BAKELIKE PINK,8,12/4/11 13:54,"3,75",Germany
580511,22865,HAND WARMER OWL DESIGN,24,12/4/11 13:54,"2,1",Germany
580511,22867,HAND WARMER BIRD DESIGN,24,12/4/11 13:54,"2,1",Germany
580511,22993,SET OF 4 PANTRY JELLY MOULDS,12,12/4/11 13:54,"1,25",Germany
580511,23240,SET OF 4 KNICK KNACK TINS DOILY,6,12/4/11 13:54,"4,15",Germany
580511,23236,STORAGE TIN VINTAGE DOILY,6,12/4/11 13:54,"2,89",Germany
580511,23493,VINTAGE DOILY TRAVEL SEWING KIT,10,12/4/11 13:54,"1,95",Germany
580511,22629,SPACEBOY LUNCH BOX,12,12/4/11 13:54,"1,95",Germany
580511,22029,SPACEBOY BIRTHDAY CARD,24,12/4/11 13:54,"0,42",Germany
580511,22551,PLASTERS IN TIN SPACEBOY,12,12/4/11 13:54,"1,65",Germany
580511,23389,SPACEBOY MINI BACKPACK,4,12/4/11 13:54,"4,15",Germany
580511,22630,DOLLY GIRL LUNCH BOX,12,12/4/11 13:54,"1,95",Germany
580511,84510A,SET OF 4 ENGLISH ROSE COASTERS,10,12/4/11 13:54,"1,25",Germany
580511,22692,DOORMAT WELCOME TO OUR HOME,4,12/4/11 13:54,"8,25",Germany
580511,22915,ASSORTED BOTTLE TOP  MAGNETS,12,12/4/11 13:54,"0,42",Germany
580511,22725,ALARM CLOCK BAKELIKE CHOCOLATE,8,12/4/11 13:54,"3,75",Germany
580511,21154,RED RETROSPOT OVEN GLOVE,10,12/4/11 13:54,"1,25",Germany
580511,21212,PACK OF 72 RETROSPOT CAKE CASES,24,12/4/11 13:54,"0,55",Germany
580511,22632,HAND WARMER RED RETROSPOT,12,12/4/11 13:54,"2,1",Germany
580511,23237,SET OF 4 KNICK KNACK TINS LEAF,6,12/4/11 13:54,"4,15",Germany
580511,23244,ROUND STORAGE TIN VINTAGE LEAF,6,12/4/11 13:54,"1,95",Germany
580511,23235,STORAGE TIN VINTAGE LEAF,6,12/4/11 13:54,"2,89",Germany
580511,21484,CHICK GREY HOT WATER BOTTLE,8,12/4/11 13:54,"4,25",Germany
580511,POST,POSTAGE,4,12/4/11 13:54,18,Germany
